{
  "$schema": "../../../../schemas/coffee.schema.json",
  "schemaVersion": 1,
  "id": "example-coffee",
  "name": "Example Coffee",
  "roasteryId": "example-roastery",
  "status": "unknown",
  "origin": {
    "country": "India",
    "region": "Example region"
  },
  "farm": "Example farm",
  "altitudeM": 1500,
  "processing": ["Washed"],
  "roastLevel": "Medium",
  "tastingNotes": ["Chocolate", "Stone fruit"],
  "productUrl": "https://example.com/coffee",
  "source": {
    "url": "https://example.com/coffee",
    "checkedAt": "2026-08-20"
  },
  "updatedAt": "2026-08-20"
}
